{
  "version": 1,
  "board": {
    "name": "Your Ops",
    "wordmark": "your ops",
    "tagline": "Your operations, in view.",
    "footer": "Your Ops · private",
    "timezone": "America/Chicago",
    "ownerName": "Your name",
    "ownerInitials": "YN",
    "ownerRole": "Personal workspace",
    "operatorLabel": "You",
    "demo": true,
    "auth": "none"
  },
  "theme": {
    "mode": "system",
    "accent": "#2452ce"
  },
  "machines": [
    {
      "id": "build-box-01",
      "name": "build-box-01",
      "role": "Builds, tests, and CI jobs",
      "kind": "linux",
      "location": "Home lab",
      "locationKind": "home",
      "host": "198.51.100.20",
      "user": "ci",
      "auth": "ssh-key",
      "keyEnv": "SSH_KEY_BUILD_BOX_01",
      "knownHostsEnv": "SSH_KNOWN_HOSTS",
      "icon": "monitor",
      "checks": [
        { "adapter": "heartbeat", "options": { "file": "heartbeats/build-box-01.json", "maxAge": "15m", "tokenEnv": "HEARTBEAT_TOKEN_BUILD_BOX_01" } },
        { "adapter": "ssh-uptime", "options": { "maxAge": "15m" } }
      ]
    },
    {
      "id": "laptop-dev",
      "name": "laptop-dev",
      "role": "Local development machine",
      "kind": "mac",
      "location": "Home lab",
      "locationKind": "home",
      "host": "192.0.2.44",
      "user": "dev",
      "auth": "ssh-agent",
      "knownHostsEnv": "SSH_KNOWN_HOSTS",
      "icon": "monitor",
      "checks": [
        { "adapter": "heartbeat", "options": { "file": "heartbeats/laptop-dev.json", "maxAge": "15m", "tokenEnv": "HEARTBEAT_TOKEN_LAPTOP_DEV" } }
      ]
    },
    {
      "id": "acme-vps-1",
      "name": "acme-vps-1",
      "role": "APIs, docs, and status pages",
      "kind": "vps",
      "location": "Cloud",
      "locationKind": "cloud",
      "host": "203.0.113.10",
      "user": "deploy",
      "auth": "ssh-key",
      "keyEnv": "SSH_KEY_ACME_VPS_1",
      "knownHostsEnv": "SSH_KNOWN_HOSTS",
      "icon": "server",
      "checks": [
        { "adapter": "ssh-uptime", "options": { "maxAge": "15m" } },
        { "adapter": "heartbeat", "options": { "file": "heartbeats/acme-vps-1.json", "maxAge": "15m", "tokenEnv": "HEARTBEAT_TOKEN_ACME_VPS_1" } }
      ]
    },
    {
      "id": "acme-vps-2",
      "name": "acme-vps-2",
      "role": "Main application host",
      "kind": "vps",
      "location": "Cloud",
      "locationKind": "cloud",
      "host": "203.0.113.11",
      "user": "deploy",
      "auth": "ssh-key",
      "keyEnv": "SSH_KEY_ACME_VPS_2",
      "knownHostsEnv": "SSH_KNOWN_HOSTS",
      "icon": "server",
      "checks": [
        { "adapter": "ssh-uptime", "options": { "maxAge": "15m" } },
        { "adapter": "heartbeat", "options": { "file": "heartbeats/acme-vps-2.json", "maxAge": "15m", "tokenEnv": "HEARTBEAT_TOKEN_ACME_VPS_2" } }
      ]
    }
  ],
  "apps": [
    {
      "id": "example-app",
      "name": "example-app",
      "url": "https://app.example.com",
      "healthUrl": "https://app.example.com/healthz",
      "hostname": "app.example.com",
      "host": "acme-vps-2",
      "repo": "example-org/example-app",
      "summary": "Sample web application used to show a failing check.",
      "signIn": "Example IdP. The health check does not sign in.",
      "dependencies": ["api-gateway"],
      "checks": [
        { "adapter": "http", "attention": true, "options": { "expect": [200], "maxAge": "2h" } }
      ],
      "troubleshooting": [
        { "title": "Read the health URL", "text": "Open the health URL from a network that is allowed to see it. A 502 here is the app, not the dashboard." },
        { "title": "Check the last deploy", "text": "On Deployments, confirm the latest run on main failed before restarting anything." },
        { "title": "Restart only the app", "text": "Restart the service on its host. Do not rotate tokens as a first step." }
      ]
    },
    {
      "id": "api-gateway",
      "name": "api-gateway",
      "url": "https://api.example.com",
      "healthUrl": "https://api.example.com/health",
      "hostname": "api.example.com",
      "host": "acme-vps-1",
      "repo": "example-org/api-gateway",
      "summary": "Public API front door for the sample.",
      "signIn": "No sign-in on the health URL.",
      "dependencies": [],
      "checks": [
        { "adapter": "http", "options": { "expect": [200], "maxAge": "2h" } }
      ],
      "troubleshooting": [
        { "title": "Confirm the process is up", "text": "A responding health URL means the process answered. It does not prove every route works." }
      ]
    },
    {
      "id": "docs-site",
      "name": "docs-site",
      "url": "https://docs.example.com",
      "healthUrl": "https://docs.example.com/",
      "hostname": "docs.example.com",
      "host": "acme-vps-1",
      "repo": "example-org/docs-site",
      "summary": "Documentation site that asks visitors to sign in.",
      "signIn": "Sign-in required for readers. 401 is the expected answer.",
      "dependencies": [],
      "checks": [
        { "adapter": "http", "options": { "expect": [200, 401], "maxAge": "2h" } }
      ],
      "troubleshooting": [
        { "title": "401 is not an outage", "text": "Sign-in required means the site answered and asked for a session." }
      ]
    },
    {
      "id": "status-page",
      "name": "status-page",
      "url": "https://status.example.com",
      "healthUrl": "https://status.example.com/",
      "hostname": "status.example.com",
      "host": "acme-vps-1",
      "repo": "example-org/status-page",
      "summary": "Public status page with no deploy workflow tracked.",
      "signIn": "Public. No sign-in.",
      "dependencies": ["api-gateway"],
      "checks": [
        { "adapter": "http", "options": { "expect": [200], "maxAge": "2h" } }
      ],
      "troubleshooting": [
        { "title": "Not tracked is honest", "text": "If no workflow is configured, the deploy badge stays Not tracked instead of pretending the last ship succeeded." }
      ]
    }
  ],
  "repos": [
    {
      "id": "repo-example-app",
      "name": "example-app",
      "repo": "example-org/example-app",
      "branch": "main",
      "workflow": "deploy.yml",
      "app": "example-app",
      "tokenEnv": "GITHUB_TOKEN",
      "checks": [
        { "adapter": "github-actions", "options": { "workflow": "deploy.yml", "branch": "main", "tokenEnv": "GITHUB_TOKEN" } }
      ]
    },
    {
      "id": "repo-infra",
      "name": "infra",
      "repo": "example-org/infra",
      "branch": "main",
      "workflow": "deploy.yml",
      "tokenEnv": "GITHUB_TOKEN",
      "checks": [
        { "adapter": "github-actions", "options": { "workflow": "deploy.yml", "branch": "main", "tokenEnv": "GITHUB_TOKEN" } }
      ]
    },
    {
      "id": "repo-docs-site",
      "name": "docs-site",
      "repo": "example-org/docs-site",
      "branch": "main",
      "workflow": "deploy.yml",
      "app": "docs-site",
      "tokenEnv": "GITHUB_TOKEN",
      "checks": [
        { "adapter": "github-actions", "options": { "workflow": "deploy.yml", "branch": "main", "tokenEnv": "GITHUB_TOKEN" } }
      ]
    },
    {
      "id": "repo-status-page",
      "name": "status-page",
      "repo": "example-org/status-page",
      "branch": "main",
      "workflow": "",
      "app": "status-page",
      "tokenEnv": "GITHUB_TOKEN",
      "checks": [
        { "adapter": "static", "attention": false, "options": { "state": "unknown", "label": "Not tracked", "detail": "No workflow is configured for this repo." } }
      ]
    }
  ],
  "agents": [
    {
      "id": "triage-bot",
      "name": "triage-bot",
      "role": "Sorts new issues",
      "reportsTo": "you",
      "avatar": "robot-1",
      "heartbeat": "https://demo.example.com/agents/triage/heartbeat",
      "checks": [
        { "adapter": "heartbeat", "options": { "url": "https://demo.example.com/agents/triage/heartbeat", "maxAge": "2h", "tokenEnv": "HEARTBEAT_TOKEN_TRIAGE" } }
      ]
    },
    {
      "id": "deploy-bot",
      "name": "deploy-bot",
      "role": "Ships tagged builds",
      "reportsTo": "you",
      "avatar": "robot-2",
      "heartbeatFile": "heartbeats/deploy-bot.json",
      "checks": [
        { "adapter": "heartbeat", "options": { "file": "heartbeats/deploy-bot.json", "maxAge": "2h", "tokenEnv": "HEARTBEAT_TOKEN_DEPLOY" } }
      ]
    },
    {
      "id": "review-bot",
      "name": "review-bot",
      "role": "Reviews pull requests",
      "reportsTo": "triage-bot",
      "avatar": "robot-3",
      "heartbeat": "https://demo.example.com/agents/review/heartbeat",
      "checks": [
        { "adapter": "heartbeat", "options": { "url": "https://demo.example.com/agents/review/heartbeat", "maxAge": "2h", "tokenEnv": "HEARTBEAT_TOKEN_REVIEW" } }
      ]
    }
  ],
  "network": {
    "places": [
      {
        "id": "home-lab",
        "name": "Home lab",
        "kind": "home",
        "note": "Documentation addresses only",
        "nodes": ["build-box-01", "laptop-dev"]
      },
      {
        "id": "cloud",
        "name": "Cloud",
        "kind": "cloud",
        "note": "Two sample VPS servers",
        "nodes": ["acme-vps-1", "acme-vps-2"]
      },
      {
        "id": "edge",
        "name": "Public edge",
        "kind": "edge",
        "note": "example.com hostnames",
        "nodes": ["app:example-app", "app:api-gateway", "app:docs-site", "app:status-page"]
      }
    ]
  },
  "devices": {
    "summary": "Network, cameras, lighting, climate, media & appliances",
    "groups": [
      {
        "id": "network",
        "name": "Network",
        "summary": "Gateway and access points on documentation addresses.",
        "icon": "flow",
        "items": [
          { "name": "gateway-01", "detail": "192.0.2.1", "state": "ok" },
          { "name": "ap-north", "detail": "192.0.2.2", "state": "ok" }
        ]
      },
      {
        "id": "cameras",
        "name": "Cameras",
        "summary": "Sample cameras. No live stream is connected.",
        "icon": "camera",